{
  "schema_version": "1.0",
  "job_id": "job-vidyarthi-101-001",
  "course_id": "vidyarthi:platform:101",
  "course_revision": "approved-revision-id",
  "submission_id": "submission-001",
  "runner": "wasm",
  "tests": ["assessments/tests/basic.json"],
  "limits": {
    "timeout_seconds": 30,
    "memory_mb": 128,
    "network": false
  }
}
